{
  "schemaVersion": "cluster.result-pack.v1",
  "resultPackId": "018f48f2-2e20-7e53-976b-cf93e0897703",
  "resultPackSha256": "1111111111111111111111111111111111111111111111111111111111111111",
  "jobId": "018f48f2-2e20-7e53-976b-cf93e08976ff",
  "workflowTemplate": "cluster.v1",
  "molecularSnapshot": {
    "schemaVersion": "burrete.molecular-snapshot.v1",
    "snapshotId": "018f48f2-2e20-7e53-976b-cf93e0897701",
    "snapshotSha256": "cccccccccccccccccccccccccccccccccccccccccccccccccccccccccccccccc",
    "frozenSource": {
      "documentFingerprintSha256": "dddddddddddddddddddddddddddddddddddddddddddddddddddddddddddddddd",
      "sourceRevision": 1,
      "recordCount": 2,
      "orderedRecordMoleculeIdentitySha256": "ffffffffffffffffffffffffffffffffffffffffffffffffffffffffffffffff"
    },
    "manifest": {
      "relativePath": "snapshot/manifest.json",
      "sha256": "2222222222222222222222222222222222222222222222222222222222222222",
      "byteLength": 128,
      "mediaType": "application/json"
    }
  },
  "enginePacks": [
    {
      "schemaVersion": "cluster.engine-pack.v1",
      "enginePackId": "018f48f2-2e20-7e53-976b-cf93e0897720",
      "enginePackSha256": "eeeeeeeeeeeeeeeeeeeeeeeeeeeeeeeeeeeeeeeeeeeeeeeeeeeeeeeeeeeeeeee",
      "workflowTemplate": "cluster.v1",
      "snapshotId": "018f48f2-2e20-7e53-976b-cf93e0897701",
      "snapshotSha256": "cccccccccccccccccccccccccccccccccccccccccccccccccccccccccccccccc",
      "engineId": "rdkitMorganBit",
      "engineVersion": "2025.03.4",
      "normalizedSettingsSha256": "ffffffffffffffffffffffffffffffffffffffffffffffffffffffffffffffff",
      "manifest": {
        "relativePath": "engine/manifest.json",
        "sha256": "9999999999999999999999999999999999999999999999999999999999999999",
        "byteLength": 128,
        "mediaType": "application/json"
      }
    }
  ],
  "layout": {
    "files": [
      {
        "relativePath": "pack/data.bin",
        "sha256": "aaaaaaaaaaaaaaaaaaaaaaaaaaaaaaaaaaaaaaaaaaaaaaaaaaaaaaaaaaaaaaaa",
        "byteLength": 18,
        "mediaType": "application/octet-stream"
      }
    ],
    "arrays": [
      {
        "name": "clusterIds",
        "semantic": "cluster_id",
        "unit": null,
        "fileRelativePath": "pack/data.bin",
        "dtype": "u64",
        "shape": [
          2
        ],
        "byteOrder": "littleEndian",
        "alignment": 8,
        "byteOffset": 0,
        "byteLength": 16
      },
      {
        "name": "representatives",
        "semantic": "is_representative",
        "unit": null,
        "fileRelativePath": "pack/data.bin",
        "dtype": "bool8",
        "shape": [
          2
        ],
        "byteOrder": "notApplicable",
        "alignment": 1,
        "byteOffset": 16,
        "byteLength": 2
      }
    ]
  },
  "createdAtMs": 10
}
